{
  "schema_version": 1,
  "artifact_type": "repository_custody_request",
  "request_id": "repository-custody-request:example-provision-001",
  "requested_at": "2026-08-29T14:00:00Z",
  "action": "provision-new",
  "operator_ref": {
    "uri": "https://workspace-governance.local/operators/example",
    "digest": "sha256:1111111111111111111111111111111111111111111111111111111111111111"
  },
  "workflow": {
    "workflow_id": "repository-custody",
    "workflow_version": "1",
    "execution_id": "repository-custody-example-provision-001"
  },
  "target": {
    "provider": "github",
    "provider_host": "github.com",
    "owner": "example-organization",
    "owner_scope": "organization",
    "name": "example-repository",
    "provider_repository_id": null
  },
  "provisioning": {
    "description": "Example governed repository.",
    "visibility": "private",
    "initialize_with_readme": true,
    "features": {
      "issues": true,
      "projects": false,
      "wiki": false,
      "discussions": false
    },
    "merge_policy": {
      "allow_squash_merge": true,
      "allow_merge_commit": false,
      "allow_rebase_merge": false,
      "delete_branch_on_merge": true
    }
  },
  "requested_custody": {
    "workspace_owner_ref": "repo:example-repository",
    "custody_kind": "dedicated-owner-repo"
  },
  "authority": {
    "policy_profile_ref": {
      "uri": "https://workspace-governance.local/policy/repository-custody/v1",
      "digest": "sha256:2222222222222222222222222222222222222222222222222222222222222222"
    },
    "approval_ref": {
      "uri": "https://workspace-governance.local/approvals/repository-custody/example-provision-001",
      "digest": "sha256:8888888888888888888888888888888888888888888888888888888888888888"
    },
    "credential_binding_ref": {
      "uri": "https://platform-engineering.local/credential-bindings/github-app/repository-create",
      "digest": "sha256:3333333333333333333333333333333333333333333333333333333333333333"
    }
  },
  "correlation": {
    "correlation_id": "repository-custody-example-provision-001",
    "causation_id": null
  },
  "idempotency_key": "repository-custody-example-provision-001",
  "request_digest": "sha256:4444444444444444444444444444444444444444444444444444444444444444"
}
